ISIN,Name,NCA,Yahoo_ticker,Main_exchange,Sector,Industry,Country,Address,Lat,Lng,Currency,Employees,Shares_outstanding,Implied_shares_outstanding,Float[%],Insiders[%],Institutions[%],Description,Termination_date,Record_retrieved,Selectable
DE000A1TNUT7,DEUTSCHE BETEILIGUNGS AG,DE,DBAN.F,Frankfurt,Financial Services,Asset Management,DE,"Untermainanlage 1 Frankfurt am Main, 60329",50.10686,8.6731,EUR,98.0,18310000.0,18310000.0,58.87,38.61,13.09,"Deutsche Beteiligungs AG is a private equity and venture capital firm specializing in direct and fund of fund investments. Within direct investments the firm specializes in expansion capital, management buyout, emerging growth, middle market, mid venture, late venture, growth capital, add-on acquisitions, bridge financing, PIPES, management buy-ins for experienced executives, corporate spin-offs, succession arrangements and generational transition in a family-owned business, small and medium-sized companies, and pre-IPO stage investments. Within fund of fund investments, the firm invests in private equity funds. The firm prefers to invest in materials, industrials, capital goods, automobiles, motorcycles manufactures, broadband telecommunications, special chemical, paper and plastic packaging, construction material, air freight and logistics, mechanical and plant engineering, automotive supply industry, industrial service providers and manufacturers of industrial components, industry tech enterprises, software, commercial and professional services, transportation, consumer discretionary, retailing, information technology, healthcare, information technology services, software services, systems software, enterprise software, broadband telecommunications, communication services, media, automation, robotics and digitalization, and services. It prefers to invest in Germany, Austria, Switzerland, Belgium, Europe, DACH region, Northern Italy, Poland, Slovakia, Hungary, Czech Republic, Netherlands, Luxembourg, Liechtenstein, Vicenza, Verona, Venice, Treviso, Trento, Bolzano, Turin, Milan, Mantova, Cremona, Brescia, Bergamo, Trieste, Ravenna, Ferrara, Bologna, and United States of America. The firm prefers to invest between 10 million ($10.86 million) and 200 million ($217.2 million) and enterprise value between 50 million ($54.3 million) and 400 million ($434.4 million) if enterprise value exceeded from 75 million ($82.92 million) to 250 million ($276.40 million) then firm invests equity capital is up to 200 million ($216.35 million). The firm prefers to take majority and minority stake in its portfolio companies. Deutsche Beteiligungs AG was founded in 1965 and is based in Frankfurt am Main, Germany with additional office in Milan, Italy, and Luxembourg.",,2025-04-27,True
DE0005810055,DEUTSCHE BÖRSE AKTIENGESELLSCHAFT,DE,DB1.DE,XETRA,Financial Services,Financial Data & Stock Exchanges,DE,"Frankfurt am Main, 60485",50.1109221,8.6821267,EUR,14515.0,183780000.0,183780000.0,99.99,0.0,65.95,"Deutsche Börse AG operates as an international exchange organization in Germany, rest of Europe, the United States, and the Asia-Pacific. It operates through four segments: Investment Management Solutions; Trading &amp; Clearing; Fund Services; and Securities Services. The company offers investment management solutions that include indices and research, such as ISS solutions, STOXX and DAX indices, index licensing, customized indices, and index calculation services; software and analytics services; pre-IPO and listing, including market structure, growth financing, going and being public, private market, and statistics/circulars; and cash, spot, and derivatives market and foreign exchange services, as well as real time market data, analytics, historical market data, and reference data. It also operates in the cash market through Xetra, Börse Frankfurt, and Tradegate trading venues; and offers Eurex and European commodity clearing services. In addition, the company offers securities services, including issuance of securities, settlement, and asset services; clearstream fund centre, which provides fund processing services; and Kneip that provides fund data management and reporting solutions for the asset management industry. Further, it engages in the operation of third clearing house Nodal Clear; and specialized software as a service platform for trading participants; and API platform, as well as provision of information technology solutions, including financial market, commodities market, and network connectivity solutions under the Deutsche Börse and 7 Market Technology brands. The company was founded in 1585 and is headquartered in Frankfurt am Main, Germany.",,2025-04-27,True
DE0008232125,DEUTSCHE LUFTHANSA AKTIENGESELLSCHAFT,DE,LHA.DE,XETRA,Industrials,Airlines,DE,"Venloer Strasse 151-153 Cologne, 50672",50.9442128,6.9283642,EUR,66111.0,120000000.0,120000000.0,,15.08,18.67,"Deutsche Lufthansa AG operates as an aviation company in Germany and internationally. It operates in three segments: Passenger Airlines; Logistics; and Maintenance, Repair and Overhaul Services (MRO). The Passenger Airlines segment offers products and services to passengers of Lufthansa Airlines, SWISS, Austrian Airlines, Brussels Airlines, and Eurowings. Its Logistics segment offers airfreight container management, urgent shipments, and customs clearance services; and e-commerce solutions. The MRO segment provides maintenance, repair, and overhaul services for civil commercial aircraft serving original equipment manufacturers, aircraft leasing companies, operators of VIP jets, government, armed forces, and airlines. It also offers payment and billing services; vocational and professional training for cockpit and cabin crew; and IT solutions. As of December 31, 2024, it had a fleet of 735 aircraft. Deutsche Lufthansa AG was founded in 1926 and is headquartered in Cologne, Germany.",,2025-04-27,True
DE0005552004,DEUTSCHE POST AG,DE,DHL.DE,XETRA,Industrials,Integrated Freight & Logistics,DE,"Charles-de-Gaulle-Str. 20 Bonn, 53250",50.7159077,7.1301354,EUR,482638.0,1150000000.0,1150000000.0,82.04,16.99,35.54,"Deutsche Post AG operates as a mail and logistics company in Germany, rest of Europe, the Americas, the Asia Pacific, the Middle East, and Africa. The company operates through five segments: Express; Global Forwarding, Freight; Supply Chain; eCommerce; and Post &amp; Parcel Germany. The Express segment offers time-definite courier and express services to business and private customers. The Global Forwarding, Freight segment provides air, ocean, and overland freight forwarding services; and offers multimodal and sector-specific solutions. The Supply Chain segment delivers customized logistics services and supply chain solutions to its customers based on modular components, including warehousing and transport services, as well as value-added services. The eCommerce segment provides parcel delivery and non-time definite international cross-border services. The Post &amp; Parcel Germany segment transports, sorts, and delivers documents and goods; and offers additional services, such as registered mail, insured items, redirection, and storage. Deutsche Post AG was incorporated in 1995 and is headquartered in Bonn, Germany.",,2025-04-27,True
DE0006305006,DEUTZ AKTIENGESELLSCHAFT,DE,DEZ.DE,XETRA,Industrials,Specialty Industrial Machinery,DE,"Ottostrasse 1 Porz-Eil Cologne, 51149",50.9016327,7.0652667,EUR,5053.0,138760000.0,138760000.0,95.96,3.81,40.37,"DEUTZ Aktiengesellschaft develops, manufactures, and sells diesel and gas engines in Europe, the Middle East, Africa, the Asia Pacific, and the Americas. The company operates through Classic and Green segments. It offers hybrid, all-electric, and hydrogen drives, including mobile rapid charging stations and related services. In addition, the company provides compact engine systems and engine accessories. The company products are used in various applications, such as construction equipment, agricultural machinery, material handling equipment, stationary equipment, commercial vehicles, rail vehicles, and other applications. DEUTZ Aktiengesellschaft was founded in 1864 and is headquartered in Cologne, Germany.",,2025-04-27,True
IT0003492391,DIASORIN SPA,IT,DIA.MI,Milan,Healthcare,Diagnostics & Research,IT,"Via Crescentino snc Saluggia, VC 13040",45.2246811,8.0273012,EUR,3249.0,53890000.0,53910000.0,40.25,57.54,21.0,"DiaSorin S.p.A. engages in development, manufacture, and distribution of immunodiagnostics and molecular diagnostics testing kits in Europe, North America, and internationally. It provides various immunodiagnostic LIAISON chemiluminescence analyzers under LIAISON XL and LIAISON XS name; and Simplexa, a congenital CMV direct kit, which detects cytomegalovirus DNA in saliva swab and urine specimens. The company was founded in 1968 and is headquartered in Saluggia, Italy.",,2025-04-27,True
IT0001469995,DIGITAL BROS SPA,IT,DIB.MI,Milan,Communication Services,Electronic Gaming & Multimedia,IT,"Via Tortona, 37 Milan, MI 20144",45.4506628,9.1581107,EUR,286.0,14270000.0,14350000.0,30.69,69.3,8.44,"Digital Bros S.p.A., together with its subsidiaries, develops, publishes, and distributes video games in Europe, the Americas, and internationally. It operates through Premium Games, Free to Play, Italian Distribution, and Other Activities segments. The Premium Games segment acquires and distributes video games through an international retail sales network and digital marketplaces, such as Steam, Sony PlayStation Network, Microsoft Xbox Live, and Epic Game Store, etc.; and publishes video games under the 505 Games and Hook brands. Its Free to Play segment develops and publishes video games and/or applications that are available for free on digital marketplaces under the 505 Mobile and 505Go! Brands. The Italian Distribution segment purchases and distributes video games under the Halifax brand in Italy. Its Other Activities segment offers video game development online training; and professional courses, including game design, game programming, concept art, and 3D game art courses. Digital Bros S.p.A. was founded in 1989 and is based in Milan, Italy.",,2025-04-27,True
IT0005347429,DIGITAL VALUE SPA,IT,DGV.MI,Milan,Technology,Information Technology Services,IT,"Via della Maglianella 65/E Rome, RM 00166",41.8895809,12.3798504,EUR,322.0,10140000.0,10140000.0,38.07,61.31,3.6,"Digital Value S.p.A. provides IT solutions and services in Italy. The company offers solutions and services for digital transformation; end-to-end system integration services; networking solutions; and insurance services. It serves telecommunications, government and defense, manufacturing, energy and utilities, utilities, transportation, banking, insurance and financial operation, media, private, public administration, and industry markets. The company is headquartered in Rome, Italy. Digital Value S.p.A. is a subsidiary of DV Holding S.p.A.",,2025-04-27,True
IT0001044996,DOVALUE SPA,IT,DOV.MI,Milan,Financial Services,Banks—Regional,IT,"Viale dell'Agricoltura, 7 Verona, VR 37135",45.4181892,10.9829379,EUR,3458.0,189580000.0,189580000.0,79.4,41.39,33.91,"doValue S.p.A. engages in the management of non-performing loans (NLP), unlikely to pay (UTP), early arrears, and performing loans for banks and investors in Italy, Spain, Greece, and Cyprus. The company offers NPL servicing, including administration, management, and recovery of loans utilizing in court and out-of-court recovery processes for and on behalf of third parties for portfolios mainly consisting in non-performing loans; and real estate servicing, such as real estate collateral management, real estate development, and property management services. It also provides administration, management, and restructuring of loans classified as unlikely-to-pay, on behalf of third parties, with the aim of returning them to performing status; and management of performing loans or loans past due by less than 90 days, not yet classified as non-performing, on behalf of third parties. In addition, the company offers services for the collection and organization of information in data room environments and advisory services for the analysis and assessment of loan portfolios for the preparation of business plans for collection and recovery activities; administrative, accounting, cash management and reporting services in support of the securitization of loans; structuring services for securitization transactions; alternative asset management services that focuses on managing third-party funds for investment in NPE portfolios, direct lending opportunities, managing of real estate assets and other asset classes; management of legal proceedings at all levels in relation to loans; sell side and buy side advisory services to support transactions on loan portfolios; and co-investment activities consisting in participating in loan securitizations with clients to obtain exclusive service level agreement. The company was formerly known as doBank S.p.A. and changed its name to doValue S.p.A. in June 2019. The company was founded in 2015 and is headquartered in Verona, Italy.",,2025-04-27,True
IT0005610958,DOVALUE SPA,IT,DOV.MI,Milan,Financial Services,Banks—Regional,IT,"Viale dell'Agricoltura, 7 Verona, VR 37135",45.4181892,10.9829379,EUR,3458.0,189580000.0,189580000.0,79.4,41.39,33.91,"doValue S.p.A. engages in the management of non-performing loans (NLP), unlikely to pay (UTP), early arrears, and performing loans for banks and investors in Italy, Spain, Greece, and Cyprus. The company offers NPL servicing, including administration, management, and recovery of loans utilizing in court and out-of-court recovery processes for and on behalf of third parties for portfolios mainly consisting in non-performing loans; and real estate servicing, such as real estate collateral management, real estate development, and property management services. It also provides administration, management, and restructuring of loans classified as unlikely-to-pay, on behalf of third parties, with the aim of returning them to performing status; and management of performing loans or loans past due by less than 90 days, not yet classified as non-performing, on behalf of third parties. In addition, the company offers services for the collection and organization of information in data room environments and advisory services for the analysis and assessment of loan portfolios for the preparation of business plans for collection and recovery activities; administrative, accounting, cash management and reporting services in support of the securitization of loans; structuring services for securitization transactions; alternative asset management services that focuses on managing third-party funds for investment in NPE portfolios, direct lending opportunities, managing of real estate assets and other asset classes; management of legal proceedings at all levels in relation to loans; sell side and buy side advisory services to support transactions on loan portfolios; and co-investment activities consisting in participating in loan securitizations with clients to obtain exclusive service level agreement. The company was formerly known as doBank S.p.A. and changed its name to doValue S.p.A. in June 2019. The company was founded in 2015 and is headquartered in Verona, Italy.",,2025-04-27,True
FR0014004339,E-PANGO,FR,ALAGO.PA,Paris,Utilities,Utilities—Renewable,FR,"26 Rue Vignon Paris, 75009",48.871698,2.3266483,EUR,6.0,2640000.0,33040000.0,,12.78,0.0,"E-Pango SA operates as an electricity and gas supplier. It serves service providers, distribution chains, leisure centers, local communities, and collective housing managers. The company was incorporated in 2016 and is headquartered in Paris, France.",,2025-04-27,True
DE000ENAG999,E.ON SE,DE,EOAN.DE,XETRA,Utilities,Utilities—Diversified,DE,"Brüsseler Platz 1 Essen, 45131",51.4254295,6.9940796,EUR,69668.0,2610000000.0,2640000000.0,85.06,15.0,40.33,"E.ON SE operates as an energy company in Germany, the United Kingdom, Sweden, the Netherlands, rest of Europe, and internationally. It operates through Energy Networks, Energy Infrastructure Solutions, and Energy Retail segments. The Energy Networks segment operates power and gas distribution networks; and offers maintenance, repair, and related services for its power and gas networks. Its Energy Infrastructure Solutions provides integrated and sustainable energy solutions for cities, municipalities, and industrial and commercial customers comprising district heating and cooling; heat, steam, and power generation services; embedded solutions; products and services that enhance energy efficiency; and software-based applications. This segment also installs smart energy meters, block-type thermal power stations, photovoltaic systems, air-conditioning systems, and heat pumps. Its Energy Retail segment distributes power and gas; installs customer connections and connects renewable energy generating stations to the grid; and offers a range of green power and green gas tariffs, and sustainable solutions that enhance energy efficiency for residential, small and medium-sized enterprises, large commercial and industrial, and sales partners. The company also provides customers digital solutions; biogas and biomethane products; and compressed natural gas refueling services, as well as installs solar and battery storage systems, heating systems, and electric vehicle charging points. E.ON SE was founded in 1923 and is headquartered in Essen, Germany.",,2025-04-27,True
FR0010908533,EDENRED,FR,EDEN.PA,Paris,Financial Services,Credit Services,FR,"14-16 boulevard Garibaldi Issy-les-Moulineaux, 92130",48.8225822,2.2614762,EUR,12320.0,239840000.0,285860000.0,94.84,0.07,85.49,"Edenred SE provides digital platform for services and payments for companies, employees, and merchants worldwide. It offers employee benefit solutions, including Ticket Restaurant, a solution that allows employees to take time out for lunch at a partner merchant; Ticket Alimentación that allows users to pay for groceries in stores and supermarkets; Edenred Regalo, a gift voucher; Ticket CESU, a human services solution; Edenred City, a solution that enables the purchase of staples, like food and fuel; Welfare Edenred, which employees can use to pay for various services, such as access to sports facilities and solutions for their children's educational needs; Ticket EcoCheque, a solutions that encourages purchase of environmentally friendly products such as Edenred Eco offered in Belgium; and Kadéos Culture in France and Ticket Cultura in Brazil that are solutions for cultural goods and services. The company also offers mobility solutions comprising Ticket Car for employees to pay for fuel and other business travel expenses; Empresarial, which enables companies to control spending to reimburse expense claims; Cintelink, a smart cloud platform for service stations and commercial fleets; UTA Edenred, a fuel card; Ticket Fleet Pro for truck fleet management; and Spirii, a platform for recharging electric vehicles. In addition, it provides complementary solutions comprising corporate payment, incentive &amp; rewards, and public social programs. Edenred SE was founded in 1962 and is headquartered in Issy-les-Moulineaux, France.",,2025-04-27,True
FR0000130452,EIFFAGE,FR,FGR.PA,Paris,Industrials,Engineering & Construction,FR,"3-7, place de l’Europe Vélizy-Villacoublay, 78140",48.7794851,2.2058189,EUR,84400.0,92260000.0,98190000.0,77.57,24.21,35.99,"Eiffage SA engages in the construction, property development, urban development, civil engineering, metallic construction, roads, energy systems, and concessions businesses in France, rest of Europe, and internationally. The Construction segment offers urban development and redevelopment, building design, property development, and maintenance and facilities management services. The Infrastructure segment undertakes civil engineering, road and rail design and building projects, drainage, earthworks, and metallic construction. The Energy Systems segment designs, constructs, integrates, operates, installs, and maintains energy and telecommunication systems. The Concessions segment constructs and operates concession and public-private partnership contracts; and develops renewable energy, including hydro and solar. The company was founded in 1844 and is based in Vélizy-Villacoublay, France.",,2025-04-27,True
IT0005453250,EL.EN. SPA,IT,ELN.MI,Milan,Healthcare,Medical Devices,IT,"Via Baldanzese, 17 Calenzano, FI 50041",43.8533868,11.1775656,EUR,2080.0,80040000.0,81430000.0,5.68,43.13,27.58,"EL.En. S.p.A. engages in the research, development, production, sale, and distribution of laser solutions in Italy, rest of Europe, and internationally. The company offers lasers for medical fields, including dermatology, surgery, aesthetics, physiotherapy, dentistry, urology, and gynecology; industrial fields, such as cutting, marking, and welding of metals, wood, plastics, and glass, as well as decoration of leather, paper, cardboard, and fabrics; and laser technology for the conservative restoration of artworks. It also provides other technologies comprising microwaves, electromagnetic fields, and radio frequencies. The company was founded in 1981 and is headquartered in Calenzano, Italy.",,2025-04-27,True
FR0011950732,ELIOR GROUP,FR,ELIOR.PA,Paris,Consumer Cyclical,Restaurants,FR,"Tour EgEe 11, allEe de lArche Cedex Paris, 92032",48.8951068,2.2382231,EUR,133156.0,253040000.0,257530000.0,4.4,48.85,18.83,"Elior Group SA offers contract catering and support services in France and internationally. The company provides contract catering services to business and industry, education, and healthcare sectors under the Elior brand. It also offers various services under the Elior Services brand, such as cleaning services, facility management, electrical and climate engineering, multi-technology maintenance, hosting and reception services, remote surveillance, energy efficiency, public lighting, green spaces, temporary employment agencies, and subcontracting in the engineering and aerospace industries, etc. Elior Group SA operates restaurants and points of sale. The company was founded in 1991 and is headquartered in Paris, France.",,2025-04-27,True
FR0012435121,ELIS,FR,ELIS.PA,Paris,Industrials,Specialty Business Services,FR,"5 Boulevard Louis Loucheur Saint-Cloud, 92210",48.8610177,2.2126239,EUR,56757.0,233640000.0,250060000.0,67.96,18.47,49.57,"Elis SA provides flat linen, workwear, and hygiene and well-being solutions in France, Central Europe, Scandinavia, Eastern Europe, the United Kingdom, Ireland, Latin America, Southern Europe, and internationally. The company offers table, bed, kitchen, patient, and bath linens; workwear and personal protective equipment; beverage solutions, such as water coolers and accessories, cups and bottles, and coffee machines; floor protection mats and mops; industrial wipers; and pest and rodent control, insect control, or disinfection services. It provides washroom hygiene services, such as hand washing and drying, toilet hygiene and urinals, lavatories, and air fragrancing; and reusable cleanroom garments, footwear, goggles, and related contamination control solutions, as well as cleaning systems. In addition, the company offers various solutions for collection and disposal of infectious waste, as well as laundry facilities. It serves the catering, accommodation, healthcare and social welfare, industries, trade and retail, and services sectors, as well as public authorities and administration. The company was founded in 1883 and is headquartered in Saint-Cloud, France.",,2025-04-27,True
DE0005677108,ELMOS SEMICONDUCTOR SE,DE,ELG.DE,XETRA,Technology,Semiconductors,DE,"Werkstättenstraße 18 leverkusen, 51379",51.0648174,7.0101838,EUR,1161.0,17140000.0,17230000.0,44.11,63.32,17.4,"Elmos Semiconductor SE develops, manufactures, and distributes microelectronic components and system parts, and technological devices for automotive industry in Germany, other European Union countries, the Americas, Asia/Pacific, and internationally. The company provides motor control IC solutions, which includes stepper motor controller IC, brushless DC motor controller IC, and DC motor controller IC; sensor ICs, such as ultrasonic distance IC, sensor signal processor IC, integrated absolute pressure system IC, optical IR sensor IC, ToF imager, and passive infrared IC; and LED driver ICs, such as high voltage, liner LED, and LIN RGB controller ICs. It offers DC/DC converter IC; low dropout (LDO) regulator; and interface ICs, which includes PSI5, LIN/CAN, and KNX transceiver. In addition, it offers ASIC design, automotive safety IC, engine management IC, and relay driver ICs. It serves automotive and non-automotive applications comprising smart home and industrial automation applications. The company was founded in 1984 and is headquartered in leverkusen, Germany.",,2025-04-27,True
