ISIN,Name,NCA,Yahoo_ticker,Main_exchange,Sector,Industry,Country,Address,Lat,Lng,Currency,Employees,Shares_outstanding,Implied_shares_outstanding,Float[%],Insiders[%],Institutions[%],Description,Termination_date,Record_retrieved,Selectable
DE0006231004,INFINEON TECHNOLOGIES AG,DE,IFX.DE,XETRA,Technology,Semiconductors,DE,"Am Campeon 1-15 Neubiberg, 85579",48.0802968,11.6146179,EUR,58008.0,130000000.0,130000000.0,100,0.0,53.53,"Infineon Technologies AG engages in the design, development, manufacture, and marketing of semiconductors and semiconductor-based solutions worldwide. Its Automotive segment offers automotive microcontrollers; 3D ToF, gas, magnetic, and pressure sensors; discrete power semiconductors; IGBT modules; industrial microcontrollers; power and memory ICs; transceivers; diodes, MOSEFTs, and modules; and voltage regulators for use in assistance and safety systems, comfort electronics, infotainment, powertrain, and security products. The company's Green Industrial Power segment provides bare dies, discrete IGBTs, and driver ICs; SiC diodes, MOSFETs, and modules; and IGBT modules for home appliances, industrial drives, industrial power supplies, industrial robotics, industrial vehicles, and traction, as well as for energy generation, storage, and transmission. Its Power &amp; Sensor Systems segment offers chips for gas and pressure sensors, and MEMS microphones; 3D ToF sensors; control ICs; discrete low-, mid-, and high-voltage power MOSFET; customized chips; GaN power switches; GPS low-noise amplifiers; low-voltage and high-voltage driver ICs; radar sensor ICs; RF antenna switches and power transistors; transient voltage suppressor diodes; SiC diode and MOSFETs; and USB controllers for use in audio amplifiers, automotive electronics, BLDC motors, cellular communications infrastructure, electric vehicle charging stations, human machine interaction, IoT, LED and conventional lighting systems, microinverter, mobile devices, power management, and special applications. The company's Connected Secure Systems segment provides connectivity solutions, embedded security controllers, microcontrollers, and security controllers for authentication, automotive, consumer electronics, government identification document, IoT, mobile communication, payment system, ticketing, access control, and computing applications. The company was incorporated in 1999 and is headquartered in Neubiberg, Germany.",,2025-04-27,True
IT0005090300,INFRASTRUTTURE WIRELESS ITALIANE SPA - INWIT,IT,INW.MI,Milan,Real Estate,Real Estate Services,IT,"Piazza Trento, 10 Rome, RM 00198",41.9173295,12.5052019,EUR,328.0,931770000.0,1020000000.0,3.48,65.02,18.62,"Infrastrutture Wireless Italiane S.p.A. operates in the electronic communications infrastructure sector in Italy. The company builds and manages digital and shared infrastructures, which houses the radio transmission equipment of mobile, FWA, and IoT telecom operators; provides pylons for antennas, cables, and dishes; spaces for equipment; and technological systems for power supply and air conditioning systems for developing wireless networks, sensors, IoT, and VDS. It also offers management, development, and backhauling services; acquires stations for development of the network; manages contracts for the sale or leasing of land; and design sites and obtain permits, as well as provision of statistical and structural assessments, and building work for development and installation of infrastructures. In addition, the company provides indoor and outdoor coverage services through micro-cells and distributed antenna system, which includes development of coverage in stations, hospitals, airports, motorways, shopping centres, stadiums and meeting, and entertainment venues, as well as public administrations, museums, production complexes, sports facilities, hotels, amusement parks, credit institutes, offices, co-working spaces, and car parks. It serves fixed wireless access operators; broadcasting services operators; and institutions, public entities, and armed forces. The company was founded in 2015 and is headquartered in Rome, Italy.",,2025-04-27,True
DE000A2NBX80,INSTONE REAL ESTATE GROUP SE,DE,INS.F,Frankfurt,Real Estate,Real Estate—Development,DE,"Grugaplatz 2-4 Essen, 45131",51.430621,7.002242,EUR,341.0,43320000.0,43320000.0,88.71,10.41,71.22,"Instone Real Estate Group SE, together with its subsidiaries, develops residential real estate properties in Germany. It develops residential and multi-family buildings, apartment complexes and publicly subsidized housing, designs contemporary urban districts, and renovates listed buildings. The company also sells and rents residential quarters with apartments and refurbishes listed buildings for residential use. Instone Real Estate Group SE was founded in 1991 and is headquartered in Essen, Germany.",,2025-04-27,True
FR0000073298,IPSOS,FR,IPS.PA,Paris,Industrials,Consulting Services,FR,"35, rue du Val de Marne Paris, 75013",48.8160673,2.3462908,EUR,20000.0,42780000.0,44330000.0,83.01,14.59,51.86,"Ipsos SA, through its subsidiaries, provides survey-based research services for companies and institutions in Europe, the Middle East, Africa, the Americas, and the Asia-Pacific. The company offers services in the information production and analysis chain, including data collection, data processing and integration, data analysis, information delivery and presentation, and information activation. It also provides audience measurement, automotive and mobility development, brand health tracking, channel performance, corporate reputation, creative excellence, customer experience, healthcare, innovation, Ipsos MMA, Ipsos UU, market strategy and understanding, observer, public affairs, social intelligence analytics, and other specialist services, as well as research methodologies, such as device agnosticism, programmatic sampling, and digital face-to-face interview. In addition, the company offers online and mobile integrated services and device agnostic solutions that include online surveys adapted to laptops, smartphones, and tablets; and qualitative research services, as well as operates Ipsos.Digital, a do-it-yourself platform. Further, it provides artificial intelligence and data science solutions that develops and provides analytical tools based on data science, machine learning, big analytics, and modelling; and behavioral science and neuroscience solutions, as well as operates Ipsos Knowledge Centre for teams and clients. Ipsos SA was incorporated in 1975 and is headquartered in Paris, France.",,2025-04-27,True
IT0005211237,ITALGAS SPA,IT,IG.MI,Milan,Utilities,Utilities—Regulated Gas,IT,"Via Carlo Bo, 11 Milan, MI 20143",45.4404729,9.1642221,EUR,4295.0,811750000.0,845160000.0,5.85,43.68,38.22,"Italgas S.p.A., together with its subsidiaries, engages in the distribution of natural gas in Italy, Greece, and Other European Union countries. It operates through Gas distribution, Water Service, and Energy Efficiency segments. The company involved in the transportation of gas to households, enterprises, etc. It also engages in metering activities; and collection, adduction, and distribution of water for civil use, drains, and the purification of wastewater. The company operated a distribution network of 82,034 kilometers and water distribution network of 6300 kilometers. Italgas S.p.A. was founded in 1837 and is based in Milan, Italy.",,2025-04-27,True
NL0015000LU4,IVECO GROUP N.V.,IT,IVG.MI,Milan,Industrials,Farm & Heavy Construction Machinery,IT,"Via Puglia n. 35 Turin, TO 10156",45.1070924,7.7233013,EUR,36046.0,264330000.0,264330000.0,63.56,27.06,41.15,"Iveco Group N.V. engages in the design, production, marketing, sale, servicing, and financing of trucks, commercial vehicles, buses and specialty vehicles, combustion engines, alternative propulsion systems, transmissions, axles, engines, alternative propulsion systems, construction equipment, marine, and power generation applications in Europe, South America, North America, and internationally. The company operates through five segments: Truck, Bus, Defence, Powertrain, and Financial Services. It offers light, medium, and heavy vehicles for the transportation and distribution of goods under the IVECO brand; minibuses, city-buses, intercity buses, and coaches under the IVECO BUS and HEULIEZ brands; vehicles for civil defense and peace-keeping missions under the IDV brand; and large-scale heavy-duty quarry, and construction vehicles under the ASTRA brand. The company also designs, manufactures, and distributes powertrains, combustion engines, alternative propulsion systems, transmission systems, and axles for on- and off-road applications, as well as for marine, and power generation under the FPT Industrial brand. In addition, it offers financial products and services to dealers and customers; and administers retail and wholesale financing services to customers for the purchase or lease of new and used vehicles sold by brand dealers and distributors. Iveco Group N.V. was founded in 1975 and is headquartered in Turin, Italy.",,2025-04-27,True
DE000A2NB601,JENOPTIK AKTIENGESELLSCHAFT,DE,JEN.DE,XETRA,Technology,Electronic Components,DE,"Carl-Zeiss-Strasse 1 Jena, 07743",50.9280972,11.5808213,EUR,4071.0,57240000.0,57240000.0,86.18,11.0,45.21,"Jenoptik AG provides advanced photonic solutions and smart mobility solutions in Germany and internationally. The company provides imaging solutions and cameras, including microscope and thermographic camera, imaging modules, polymer-based camera modules, and miniaturized digital microscope subsystem; and laser and laser technology, such as laser ablation, scoring, cutting, and rangefinder, as well as laser OEM solutions comprising diode laser and disk laser technology, diode pumped disk lasers, laser systems, and LK heat sink. It offers optics and optical systems, including objective lenses for laser material processing, cd objective lenses, optical coatings and measuring systems, and precision optical components; optical shaft measuring systems, optical 3D measurement technology, optical in-line inspection, vision-systems, and ultra-fast opto-electronic probe card; and optoelectronics and optoelectronic systems comprising system partner for optoelectronic systems, customized-specific optoelectronic systems, optoelectronics assemblies and subsystems, light modulation, and photodiodes and LEDs. In addition, the company offers road safety solutions, such as speed enforcement, average speed cameras, red light cameras, evaluation software, and traffic services; and civil security solutions, including automatic number plate recognition and data analysis software, border security, combating organized crime, protecting public places, and monitoring suspect vehicles. It serves automotive, defense and security, electronics and information technology, medical and life science, industry and mechanical engineering, semiconductor equipment, and public safety sectors. Jenoptik AG was founded in 1846 and is headquartered in Jena, Germany.",,2025-04-27,True
IT0005572778,JUVENTUS FOOTBALL CLUB SPA,IT,JUVE.MI,Milan,Communication Services,Entertainment,IT,"Via Druento 175 Turin, TO 10151",45.1126642,7.6337918,EUR,1085.0,379120000.0,38010000.0,34.22,73.6,11.73,"Juventus Football Club S.p.A. operates as a professional football club in Italy. The company participates in national and international football competitions, as well as organizes matches. It involved in audiovisual and media rights; sponsorships, operation of stadium, direct retail, and e-commerce activities; and brand licensing activities, as well as marketing of other services to fans; and management of players and multi-year registration rights. Juventus Football Club S.p.A. was founded in 1897 and is headquartered in Turin, Italy. Juventus Football Club S.p.A. is a subsidiary of EXOR N.V.",,2025-04-27,True
IT0000336518,JUVENTUS FOOTBALL CLUB SPA,IT,JUVE.MI,Milan,Communication Services,Entertainment,IT,"Via Druento 175 Turin, TO 10151",45.1126642,7.6337918,EUR,1085.0,379120000.0,38010000.0,34.22,73.6,11.73,"Juventus Football Club S.p.A. operates as a professional football club in Italy. The company participates in national and international football competitions, as well as organizes matches. It involved in audiovisual and media rights; sponsorships, operation of stadium, direct retail, and e-commerce activities; and brand licensing activities, as well as marketing of other services to fans; and management of players and multi-year registration rights. Juventus Football Club S.p.A. was founded in 1897 and is headquartered in Turin, Italy. Juventus Football Club S.p.A. is a subsidiary of EXOR N.V.",,2025-04-27,True
DE000KSAG888,K+S AKTIENGESELLSCHAFT,DE,SDF.DE,XETRA,Basic Materials,Agricultural Inputs,DE,"Bertha-von-Suttner Strasse 7 Kassel, 34131",51.3094142,9.4470002,EUR,10835.0,17910000.0,180520000.0,,0.99,51.46,"K+S Aktiengesellschaft, together with its subsidiaries, operates as a supplier of mineral products for the agricultural, industrial, consumer, and community sectors in Europe, the United States, Asia, Africa, and Oceania. The company offers potassium chloride for crops, such as grain, corn, rice, and soybeans; fertilizer specialties that are used for crops with magnesium and sulfur requirements, including rapeseed and potatoes, as well as for chloride-sensitive crops consisting of citrus, grapes, coffee, almond trees, and vegetables; and water-soluble fertilizers for use in fertigation of fruit and vegetables under the KALISOP, KORN-KALI, ROLL-KALI, PATENTKALI, ESTA, KIESERIT, GRANUAID, MAGNESIA-KAINIT, SOLUMOP, SOLUSOP, SOLUCMS, EPSO TOP, EPSO MICROTOP, EPSO COMBITOP, EPSO PROFITOP, and EPSO BORTOP brands. It also provides melting salts, sodium chloride, natural rock salt, high-purity vaccum salt and natural sea salt, potassium chloride, Epsom salt, minerals for pets and livestock, aluminum recycling, salt licks for farm and wild animals under the Alasal, APISAL, AXAL PRO, NUTRIKS, NUTRIKS KaliSel, KASA, k-DRILL, REGINET, and SOLSEL brand names. In addition, the company offers table salts under the SALDORO, Cérébos, Salinas d' Algrave, and Vatel brands; rock, sea, and vacuum salt; salts for water treatment under AXAL PRO; dishwashing salts under REGESOFT brand; and de-icing salts. Further, the company provides waste management; and transportation and logistics services. K+S Aktiengesellschaft was founded in 1889 and is headquartered in Kassel, Germany.",,2025-04-27,True
FR0010722819,KALRAY,FR,ALKAL.PA,Paris,Technology,Semiconductors,FR,"180 avenue de l’Europe Montbonnot-Saint-Martin, 38330",45.213954,5.8062742,EUR,221.0,11190000.0,11190000.0,74.26,0.0,3.11,"Kalray S.A. provides processors and acceleration cards in France. Its products include MPPA processor for various data transfers; Kalray Flashbox, a disaggregated NVMe storage array to use the potential of NVMe flash devices; acceleration cards; and an intelligent data processor for managing multiple workloads in parallel with no bottlenecks under the Coolidge brand. The company offers MPPA-DEV4 platform; and a software to develop, debug, and optimize applications under the AccessCore brand name. It serves storage, edge computing, artificial intelligence, and embedded sectors. Kalray S.A. was founded in 2008 and is headquartered in Montbonnot-Saint-Martin, France.",,2025-04-27,True
FR0000121485,KERING,FR,KER.PA,Paris,Consumer Cyclical,Luxury Goods,FR,"40, rue de Sèvres Paris, 75007",48.8493753,2.3220482,EUR,44627.0,122590000.0,127460000.0,57.17,42.59,25.94,"Kering SA manages the development of a collection of renowned houses in fashion, leather goods, and jewelry in the Asia Pacific, Western Europe, North America, Japan, and internationally. The company provides ready-to-wear products, accessories, and beauty products for men and women. It also offers leather goods and shoes; watches and jewelry; eyewear products; and fragrances and cosmetics. The company provides its products under the Gucci, Saint Laurent, Bottega Veneta, Balenciaga, Alexander McQueen, Brioni, Boucheron, Pomellato, DoDo, Qeelin, and Ginori 1735, as well as Kering Eyewear and Kering Beauté brands. The company was formerly known as PPR SA and changed its name to Kering SA in June 2013. Kering SA was founded in 1963 and is based in Paris, France.",,2025-04-27,True
DE000KGX8881,KION GROUP AG,DE,KGX.DE,XETRA,Industrials,Farm & Heavy Construction Machinery,DE,"Thea-Rasche-Strasse 8 Frankfurt am Main, 60549",50.055831,8.5885415,EUR,42719.0,131120000.0,131120000.0,53.48,46.5,35.6,"KION GROUP AG provides industrial trucks and supply chain solutions in Western and Eastern Europe, the Middle East, Africa, North America, Central and South America, China, and the rest of the Asia Pacific. It operates through Industrial Trucks &amp; Services; and Supply Chain Solutions segments. The company offers forklift and heavy trucks, counterbalance trucks with electric drive and internal combustion engine, intralogistics systems, components and spare parts, narrow aisle trucks, lithium-ion batteries, and industrial and warehouse trucks under the Linde, STILL, Baoli, Fenwick, and OM brands. It also leases and rents industrial trucks and related equipment; and provides maintenance and repair services, fleet management solutions, driver assistance systems, and service options, as well as finance solutions. In addition, the company offers integrated technology and software solutions, automated guided vehicle systems, warehouse automation solutions, palletizers, storage and picking equipment, automated storage and retrieval systems, system components and racking, sorters, and conveyors under the Dematic brand. Further, it provides logistics solutions; and the Control Tower software, which integrates AI-supported forecasting models. The company was formerly known as KION Holding 1 GmbH. KION GROUP AG was founded in 2006 and is headquartered in Frankfurt am Main, Germany.",,2025-04-27,True
FR0000121964,KLEPIERRE,FR,LI.PA,Paris,Real Estate,REIT—Retail,FR,"26 boulevard des Capucines Paris, 75009",48.870211,2.32844,EUR,1056.0,285840000.0,286020000.0,77.54,22.47,43.92,"Klépierre SA is the European leader in shopping malls, combining property development and asset management skills. The Company's portfolio is valued at 19.3 billion at December 31, 2023, and comprises large shopping centers in more than 10 countries in Continental Europe which together host hundreds of millions of visitors per year. Klépierre SA holds a controlling stake in Steen &amp; Strøm (56.1%), Scandinavia's number one shopping center owner and manager. Klépierre SA is a French REIT (SIIC) listed on Euronext Paris and is included in the CAC Next 20 and EPRA Euro Zone Indexes. It is also included in ethical indexes, such as Euronext CAC 40 ESG, Euronext CAC SBT 1.5, MSCI Europe ESG Leaders, FTSE4Good, Euronext Vigeo Europe 120, and features in CDP's A-list. These distinctions underscore the Group's commitment to a proactive sustainable development policy and its global leadership in the fight against climate change.",,2025-04-27,True
DE000KC01000,KLÃ¶CKNER & CO SE,DE,KCO.DE,XETRA,Basic Materials,Steel,DE,"Peter-Müller-Straße 24 Duisburg, 40468",51.2748987,6.7681043,EUR,6507.0,99750000.0,106790000.0,56.22,43.64,25.17,"Klöckner &amp; Co SE, together with its subsidiaries, distributes steel and metal products in Germany, Switzerland, France, the united states, and internationally. The company operates through two segments: Kloeckner Metals Americas and Kloeckner Metals Europe. It offers flat steel products; long steel products; tubes and hollow sections; stainless steel and high-grade steel; aluminum products; and CO2-reduced steel, stainless steel, and aluminum products for building installations, roof and wall construction, and water supply. The company also provides cutting and splitting of steel strips; forming and manufacturing of pressed parts; CNC turning/milling; 2D/3D tube laser cutting; laser and water jet cutting; structural steel processing; plasma and oxy-fuel cutting; shot blasting and primer painting; and sawing/drilling/rounding off services. In addition, it offers warehousing, logistics, and materials management services. The company serves small to medium-sized steel and metal consumers, including construction, machinery and mechanical engineering, transportation, and other metalworking companies. The company was founded in 1906 and is headquartered in Duisburg, Germany.",,2025-04-27,True
DE000A2YN504,KNAUS TABBERT AG,DE,KTA.F,Frankfurt,Consumer Cyclical,Recreational Vehicles,DE,"Helmut-Knaus-Strasse 1 Jandelsbrunn, 94118",48.7329521,13.6904994,EUR,3184.0,10380000.0,1060000.0,34.2,65.81,8.04,"Knaus Tabbert AG, together with its subsidiaries, manufactures and sells leisure vehicles in Europe. It operates through Premium and Luxury segments. The company offers motorhomes, caravans, and camper vans under the KNAUS, TABBERT, WEINSBERG, T@B, and MORELO brands, as well as caravanning utility vehicles under the TABBERT and T@B brands. It also operates RENT AND TRAVEL, a digital platform for renting leisure vehicles. Knaus Tabbert AG was founded in 1912 and is headquartered in Jandelsbrunn, Germany.",,2025-04-27,True
FR0013030152,LA FRANCAISE DE L'ENERGIE,FR,FDE.PA,Paris,Energy,Oil & Gas E&P,FR,"Avenue du District Pontpierre Faulquemont, 57380",49.048616,6.617485,EUR,48.0,5280000.0,5390000.0,99.62,30.57,25.3,"La Française de l'Energie S.A., together with its subsidiaries, operates as a carbon-negative energy production company in France and internationally. It engages in the generation of electricity and heat though photovoltaic plants; purification and liquefaction of biogas, landfill gas, flare gas, rare gases, etc.; and production of carbon dioxide and hydrogen. The company was founded in 2006 and is headquartered in Faulquemont, France.",,2025-04-27,True
FR0013451333,LA FRANCAISE DES JEUX,FR,FDJU.PA,Paris,Consumer Cyclical,Gambling,FR,"3-7 Quai du Point du Jour Cedex Boulogne-Billancourt, 92100",48.833144,2.2595308,EUR,,184780000.0,184780000.0,56.47,43.69,17.9,"FDJ United engages in the gaming operation and distribution business in France and internationally. It offers lottery games, such as draw and instant games at points of sale and online; sports betting at points of sale; online poker; online horse-race and sports betting; betting and risk management services to sports betting operators; digital gaming platform; and s sports betting technology, as well as holds and administers draws for participating lotteries. The company was formerly known as La Française des Jeux Société anonyme and changed its name to FDJ United in March 2025. The company was founded in 1933 and is headquartered in Boulogne-Billancourt, France.",,2025-04-27,True
DE0005470405,LANXESS AKTIENGESELLSCHAFT,DE,LXS.DE,XETRA,Basic Materials,Specialty Chemicals,DE,"Kennedyplatz 1 Cologne, 50569",50.937574,6.9703464,EUR,12338.0,86350000.0,86350000.0,81.37,5.14,56.38,"LANXESS Aktiengesellschaft, together with its subsidiaries, operates as a specialty chemicals company that engages in the development, manufacture, and marketing of chemical intermediates, additives, specialty chemicals, and consumer protection products worldwide. It operates through three segments: Consumer Protection, Specialty Additives, and Advanced Intermediates. The Consumer Protection segment provides material protection products; disinfectant, hygiene, and preservative solutions; flavors and fragrances; liquid purification technologies for the treatment of water and other liquids; and precursors and intermediates for the agrochemicals, pharmaceuticals, and specialty chemicals industries. The Specialty Additives segment offers additives, lubricants, flame retardants, plasticizers, and bromine derivatives for a variety of applications in for the rubber, plastic and paint, electrical/electronics, and construction industries. The Advanced Intermediates segment provides basic and fine chemicals, organometallics, and inorganic pigments for the coloring of construction materials as well as paints and coatings. The segment serves agrochemical, automotive, construction, aromas and flavors, semiconductors and photovoltaic, and color pigments industries. LANXESS Aktiengesellschaft was founded in 1863 and is headquartered in Cologne, Germany.",,2025-04-27,True
DE000LEG1110,LEG IMMOBILIEN SE,DE,LEG.DE,XETRA,Real Estate,Real Estate Services,DE,"Flughafenstrasse 99 Düsseldorf, 40474",51.2735073,6.7635535,EUR,1920.0,74470000.0,74470000.0,97.02,0.0,65.42,"LEG Immobilien SE, together with its subsidiaries, operates as an integrated property company in Germany. The company engages in the performance of services and management of equity investments; property management and location development; performance of services for third parties and housing industry services; and generation of electricity and heat activities. It also provides information technology (IT) services for third parties; and management services for third-party properties. The company's property portfolio consisted of residential units; commercial units; and garages and parking spaces in North Rhine-Westphalia. LEG Immobilien SE was founded in 1970 and is headquartered in Düsseldorf, Germany.",,2025-04-27,True
