ISIN,Name,NCA,Yahoo_ticker,Main_exchange,Sector,Industry,Country,Address,Lat,Lng,Currency,Employees,Shares_outstanding,Implied_shares_outstanding,Float[%],Insiders[%],Institutions[%],Description,Termination_date,Record_retrieved,Selectable
FR0000131906,RENAULT,FR,RNO.PA,Paris,Consumer Cyclical,Auto Manufacturers,FR,"122/122 bis avenue du GEnEral Leclerc Cedex Boulogne-Billancourt, 92100",48.8305649,2.2321299,EUR,98636.0,288860000.0,314230000.0,54.96,35.12,28.0,"Renault SA engages in the design, manufacture, sale, repair, maintenance, and leasing of motor vehicles in Europe, Eurasia, Africa, the Middle East, the Asia Pacific, and the Americas. It also engages in the design and production of parts and equipment used for manufacturing and operation vehicles. The company operates through Automotive, Sale Financing, and Mobility Services segments. Its Automotive segment produces, sells, and distributes passenger cars and light commercial vehicles; and invests in automotive-sector associates and joint ventures primarily in Nissan. The company's Sale Financing segment offers sale financing, leasing, maintenance, and services contract under the Mobilize Financial Services brand. Its Mobility Services segment provides mobility and energy solutions for electric vehicle users under the Mobilize brand. In addition, it is also involved in the design, manufacture, and sale of passenger cars and light commercial vehicles under the Renault, Dacia, Alpine, and Mobilize brands. Further, the company offers used vehicles and spare parts; and engages in business-to-business powertrain activities, and research and advanced engineering activities. Renault SA was founded in 1898 and is based in Boulogne-Billancourt, France.",,2025-04-27,True
IT0005282865,REPLY SPA,IT,REY.MI,Milan,Technology,Information Technology Services,IT,"Corso Francia, 110 Turin, TO 10143",45.0760534,7.6491316,EUR,15667.0,37280000.0,37630000.0,62.74,39.75,34.42,"Reply S.p.A. provides consulting, system integration, and digital services based on communication channels and digital media in Italy and internationally. It offers Axulus Reply, a cloud-based Industrial Internet of Things project management solution; Brick Reply, a digital as a service platform that enables the transformation of industrial operations; China Beats Reply, a market intelligence and social listening platform solution for understanding the Chinese market and its data ecosystem; Discovery Reply, a platform that centralizes and manages the life cycle of digital content, such as images, videos, audio, 3D models, documents, and data; and Lea Reply, platform designed for making supply chains efficient, agile, and connected. The company also provides KICODE Reply, a framework for software development based on generative artificial intelligence; MLFRAME Reply, a generative artificial intelligence framework for managing heterogeneous knowledge bases; Pulse Reply, a data-driven solution that combines data science and marketing intelligence in a single dashboard, including advanced data modelling and visualization capabilities; and Sonar Reply, a data-driven platform for trend research. In addition, it offers TamTamy Reply, an enterprise social network platform for corporate communication and collaboration; Ticuro Reply, a modular platform that enables processes to support prevention and continuity of care remotely for digital healthcare; and X-RAIS Reply, an artificial intelligence solution for radiological diagnosis processes through deep learning. The company serves automotive and manufacturing, energy and utilities, financial services, logistics, retail and consumer products, and telco and media industries. Reply S.p.A. was founded in 1995 and is headquartered in Turin, Italy.",,2025-04-27,True
FR0010451203,REXEL,FR,RXL.PA,Paris,Technology,Electronics & Computer Distribution,FR,"13 Boulevard du Fort de Vaux Cedex 17 CS 60002 Paris, 75017",48.8926631,2.3034002,EUR,26706.0,294770000.0,29670000.0,93.55,1.58,73.68,"Rexel S.A., together with its subsidiaries, engages in the distribution of low and ultra-low voltage electrical products for the residential, commercial, and industrial markets in France, rest of Europe, North America, and the Asia-Pacific. The company offers smart cameras, sensors, controllers, and monitoring software; light sources, lights, and control switches; heat pumps, air conditioning, and water heaters; fire alarms, surveillance equipment, access controls devices, and emergency lightings; and connection cables, and switches and routers, as well as enclosures, mounts, and racks. It also provides solar modules and inverters; connected lighting, intelligent home system, home control touch screen, and smart thermostat products; residential chargers, commercial stations, and charging cables for electric vehicles; electric motors, variable speed drives, programmable logic controllers, and computers and operator interface; and fastening systems, electrical power and control, and valves and instrumentation products. The company offers products, services, and solutions in the fields of technical supply, automation, and energy management related to the construction, renovation, maintenance, and production. The company was founded in 1967 and is headquartered in Paris, France.",,2025-04-27,True
DE0007030009,RHEINMETALL AKTIENGESELLSCHAFT,DE,RHM.DE,XETRA,Industrials,Aerospace & Defense,DE,"Rheinmetall Platz 1 Düsseldorf, 40476",51.2535985,6.7852475,EUR,28539.0,43440000.0,44590000.0,100,1.72,41.48,"Rheinmetall AG provides mobility and security technologies worldwide. The company operates in five segments: Vehicle Systems, Weapon and Ammunition, Electronic Solutions, Sensors and Actuators, and Materials and Trade. The Vehicle Systems segment offers combat, logistics, support, and special vehicles, including armored tracked vehicles, CBRN protection systems, artillery, turret systems, and wheeled logistics and tactical vehicles. The Weapon and Ammunition segment provides firepower and protection solutions, such as weapons and munition, protection systems, propellants and international projects and services. The Electronic Solutions segment offers a chain of systems network, such as sensors, networking platforms, automated connected effectors for soldiers, and cyberspace protection solutions, and training and simulation solutions. Its products include air defense systems; soldier systems; command, control, and reconnaissance systems; fire control systems; sensors; and simulations for the army, air force, navy, and civil applications. The Sensors and Actuators segment provides a portfolio of products comprising exhaust gas recirculation systems; throttle valves, control dampers, and exhaust flaps for electromotors; solenoid valves; actuators and valve train systems; oil, water, and vacuum pumps for passenger cars, commercial vehicles, and light and heavy-duty off-road applications; and industrial solutions. The Materials and Trade segment develops system components for the basic motors, such as engine blocks, structural components, and cylinder heads; plain bearings, and bushes; and replacement parts. It also engages in the aftermarket activities. The company has a strategic collaboration with Bohemia Interactive Simulations to promote the development of innovative simulation solutions for modern combat training. The company was formerly known as Rheinmetall Berlin AG and changed its name to Rheinmetall AG in 1996. Rheinmetall AG was founded in 1889 and is headquartered in Düsseldorf, Germany.",,2025-04-27,True
FR0013269123,RUBIS,FR,RUI.PA,Paris,Energy,Oil & Gas Refining & Marketing,FR,"46, rue BoissiEre Paris, 75116",48.8675698,2.289309,EUR,,102950000.0,110120000.0,75.27,25.24,27.65,"Rubis engages in the operation of bulk liquid storage facilities for commercial and industrial customers in Europe, Africa, and the Caribbean. The company operates through Energy Distribution and Renewable Electricity Production segments. It is involved in the bulk liquid storage of fuels, biofuels, chemicals, and agrifood products; and retails and distributes fuels, heating oils, lubricants, liquefied gases, and bitumen, as well as provides logistics services comprising trading-supply, refining, and shipping activities. The company also engages in the production of photovoltaic electricity; provision of car wash services; and operation of convenience stores and quick-service restaurants across various service stations operated under the RUBiS and ViTO brands. It serves transportation, infrastructure, hotel, aviation, marine, and public works sectors. Rubis was incorporated in 1954 and is headquartered in Paris, France.",,2025-04-27,True
DE000SAFH001,SAF-HOLLAND SE,DE,SFQ.F,Frankfurt,Consumer Cyclical,Auto Parts,DE,"Hauptstrasse 26 Bessenbach, 63856",49.9777719,9.2558383,EUR,4935.0,45390000.0,45390000.0,99.56,1.9,66.15,"SAF-Holland SE manufactures and supplies chassis-related assemblies and components for trailers, trucks, semi-trailers, and buses. The company offers axle and air suspension systems, fifth wheels, hweel systems, coupling systems, kingpins, and landing gears, as well as ball races, braking and EBS systems, lighting systems, and disc brakes. It markets its products under the SAF, Holland, Neway, KLL, V.Orlandi, TrailerMaster, and York brands. The company serves original equipment manufacturers. It primarily operates in Europe, the Middle East, Africa, the Americas, and the Asia Pacific. The company was founded in 1881 and is headquartered in Bessenbach, Germany.",,2025-04-27,True
IT0004604762,SAFILO GROUP SPA,IT,SFL.MI,Milan,Healthcare,Medical Instruments & Supplies,IT,"Settima Strada 15 Padua, PD 35129",45.4148613,11.9288721,EUR,3352.0,403240000.0,438050000.0,51.61,49.84,30.46,"Safilo Group S.p.A. engages in the design, production, and wholesale distribution of optical frames, sunglasses, sports eyewear, goggles, and helmets in North America, Europe, the Asia Pacific, and internationally. The company offers its products under the own brands, including Carrera, Polaroid Eyewear, Seventh Street, Smith, Blenders Eyewear, and Privé Revaux Eyewear; and licensed brands, such as BOSS, Carolina Herrera, David Beckham, DSQUARED2, Etro, Fossil, HUGO, Isabel Marant, Juicy Couture, kate Spade New York, Levi's, Liz Claiborne, Marc Jacobs, Missoni, Moschino and Love Moschin, Pierre Cardin, PORTS, Stuart Weitzman, Tommy Hilfiger, TOMMY JEANS, and Under Armour. The company sells its products to opticians, optometrists, ophthalmologists, department stores and chains, specialized retailers, licensors' own stores, and duty free and sports shops through a network of independent distribution partners and e-commerce platforms. The company was formerly known as Safilo Holding S.p.A. and changed its name to Safilo Group S.p.A. in September 2005. Safilo Group S.p.A. was founded in 1878 and is headquartered in Padua, Italy.",,2025-04-27,True
IT0005495657,SAIPEM SPA,IT,SPM.MI,Milan,Energy,Oil & Gas Equipment & Services,IT,"Via Luigi Russolo, 5 Milan, MI 20138",45.4342576,9.2399261,EUR,30000.0,1960000000.0,1960000000.0,65.31,34.01,23.25,"Saipem SpA provides energy and infrastructure solutions worldwide. It operates through Asset Based Services, Offshore Drilling, and Energy Carriers segments. The company offers development of subsea fields and pipelaying; installation and lifting of offshore structures; engages in engineering, implementation, installation, maintenance, modification, and decommissioning activities, as well as offshore engineering and construction, and wind activities. It is also involved in onshore engineering and construction, sustainable infrastructures, and robotics and industrialized solutions; and design and construction of infrastructure projects, such as railway lines in high speed/high capacity lines. In addition, the company provides procurement, project management, and construction services to oil and gas, civil and marine infrastructure, and environmental markets. Saipem S.p.A. was founded in 1957 and is headquartered in Milan, Italy.",,2025-04-27,True
IT0004712375,SALVATORE FERRAGAMO SPA,IT,SFER.MI,Milan,Consumer Cyclical,Luxury Goods,IT,"Palazzo Spini-Feroni Via dei Tornabuoni 2 Florence, FI 50123",43.7697027,11.2505859,EUR,3329.0,165680000.0,176740000.0,38.6,60.27,10.51,"Salvatore Ferragamo S.p.A., through its subsidiaries, creates, produces, and sells luxury goods for men and women in Europe, North America, Japan, the Asia Pacific, and Central and South America. The company offers men's and women's footwear; leather goods comprising handbags, suitcases, belts, wallets, and other men's and women's leather accessories; made-to-order men's and ladies products; ready to wear products for men's and ladies, including knitwear, clothes for formal occasions and outwear, such as husky jackets, ponchos, and leather garments, as well as sportswear, outwear, and informal shirts. It also provides silk accessories, such as ties, foulards, scarves, shawls, gloves, and costume jewellery, as well as plaid throws, cushions, and beach towels; men's and ladies sunglasses and prescription glasses; watches; gold, diamond, gemstone, and silver jewellery; perfumes; and fragrances. In addition, the company is involved in the real estate management business. It sells its products under the Salvatore Ferragamo brand and distributes through Salvatore Ferragamo single-brand stores, department stores and multi-brand specialty stores, and the e-commerce channel. The company was formerly known as Salvatore Ferragamo Italia S.p.A. and changed its name to Salvatore Ferragamo S.p.A. in April 2011. The company was founded in 1927 and is headquartered in Florence, Italy. Salvatore Ferragamo S.p.A. is a subsidiary of Ferragamo Finanziaria S.p.A.",,2025-04-27,True
DE0006202005,SALZGITTER AKTIENGESELLSCHAFT,DE,SZG.F,Frankfurt,Basic Materials,Steel,DE,"Eisenhüttenstraße 99 Salzgitter, 38239",52.1610603,10.4309086,EUR,23868.0,54090000.0,54290000.0,46.79,54.36,7.07,"Salzgitter AG, together with its subsidiaries, engages in steel and technology businesses worldwide. It operates through four segments: Steel Production, Steel Processing, Trading, and Technology. The Steel Production segment manufactures steel and special steels, such as hot-rolled wide strip, steel sheet, sections, tailored blanks, as well as scrap trading. The Steel Processing segment produces various high-grade heavy plates; and manufactures line pipes, HFI-welded tubes, and precision and stainless-steel tubes. The Trading segment operates a European sales network, as well as trading companies and agencies worldwide. The Technology segment engages in the provision of machinery and plants for the filling and packaging of beverages, as well as special machinery engineering for shoe manufacturing and elastomer production. The company also provides IT, facility management, logistics, automotive engineering, and research and development services, as well as supplies raw materials. The company was founded in 1858 and is headquartered in Salzgitter, Germany.",,2025-04-27,True
DE0007165607,SARTORIUS AKTIENGESELLSCHAFT,DE,SRT.F,Frankfurt,Healthcare,Medical Instruments & Supplies,DE,"Otto-Brenner-Strasse 20 Göttingen, 37079",51.5528173,9.8899136,EUR,13573.0,34230000.0,77290000.0,80.66,87.07,4.49,"Sartorius Aktiengesellschaft provides bioprocess solutions, and lab products and services worldwide. The company offers multi-parallel, benchtop, single-use, stainless steel, cell culture, rocking motion, and microbial bioreactors; software apps for bioreactors and cell culture shake flasks; fermenters; cell culture media, biolayer interferometry, microbiological testing, and fluid management products; buffers; reagents; plasmids; cellcelector flexs, incubator flowboxes, nanowell arrays, and capillaries and tips; high-throughput screening by cytometry; ultrafiltration solutions; syringe, membrane, glass and quartz microfiber, clarification, syringeless, and in-line filters; and lab chromatography, and filters and blotting papers. It also provides live-cell analysis systems, reagents and consumables, and support and services; live-cell imaging and analysis software; contract manufacturing and integration; OEM membranes and devices, weigh cells, and data analytics; connectivity, and pipetting and dispensing products; electronic and mechanical pipettes, pipette tips, bottle-top dispensers, and pipette controllers and accessories; process automation platform and software, sensors and analyzers, biomolecule analysis tools, and data analytics software; chromatography consumables, columns, and systems; and surface plasmon resonance and process filtration products. The company offers water purification systems; lab data and fleet management software; lab balances, pipette calibration, mass comparators and metrology, moisture analyzers, weights and weight sets, paint mixing solutions, and weighing accessories; and bioprocess consulting and engineering, biologics testing, cell culture media, instrument, octet service and support, and validation services. It serves the life science research, biopharmaceutical manufacturing, cell and gene therapy, and applied industries. The company was founded in 1870 and is headquartered in Göttingen, Germany.",,2025-04-27,True
FR0013154002,SARTORIUS STEDIM BIOTECH,FR,DIM.PA,Paris,Healthcare,Medical Instruments & Supplies,FR,"Zone Industrielle Les Paluds Avenue de Jouques – CS 91051 Cedex Aubagne, 13781",43.2875969,5.6038517,EUR,9961.0,97290000.0,97290000.0,28.5,71.47,10.9,"Sartorius Stedim Biotech S.A. engages in the production and sale of instruments and consumables for the biopharmaceutical industry worldwide. The company offers various products, such as cell lines; cell culture media; bioreactors; reagents; advanced therapies; and a range of products for separation, purification, and concentration processes, as well as products and systems for storage and transportation of intermediate and finished biological products. It also provides fluid management services; biolayer interferometry instruments; microbiology testing, sterility testing, and air monitoring instruments; pipette products; sensors and analyzers; screening instruments; biomolecule analysis tools; batch and intensified chromatography systems; lab data and fleet management software; live cell imaging and analysis; surface plasmon resonance solutions; water purification systems; and weighing products. In addition, the company offers data analytics software; process automation platform and software; and transfection reagents and plasmid DNA solutions. It serves manufacturers of medications, vaccines, food, and chemicals, as well as research and development laboratories. The company was incorporated in 1978 and is headquartered in Aubagne, France. Sartorius Stedim Biotech S.A. is a subsidiary of Sartorius AG.",,2025-04-27,True
DE000SHA0019,SCHAEFFLER AG,DE,SHA0.F,Frankfurt,Consumer Cyclical,Auto Parts,DE,"Industriestrasse 1-3 Herzogenaurach, 91074",49.5631716,10.8862174,EUR,115055.0,944880000.0,994540000.0,10.8,79.17,4.48,"Schaeffler AG, together with its subsidiaries, develops, manufactures, and sells components and system for industrial applications in Europe, the Americas, China, and the Asia Pacific. The Automotive Technologies division offers mechanical, mechatronic, and electronic components and systems for powertrain electrification used in passenger cars and commercial vehicles, such as electric motors, axle transmissions, axle drives, power electronics, hybrid modules, electromechanical and hydraulic actuators, and thermal management module; torque converters, hybrid dampers, clutches, variable valve train systems, valve-lash adjustment elements, balancer shafts, camshaft phasing systems, timing drives, and front end auxillary drives. This division provides rolling bearing application and products, such as wheel, ball, and needle roller bearings; and mechanical components and mechatronic systems for steering and other chassis applications, including Space Drive, a steer-by-wire system. The Automotive Aftermarket division offers components and repair solutions for light commercial vehicles, trucks and buses, and offroad sectors under the LuK, INA, and FAG brand names, as well as service for repair shops under the REPXPERT brand. The Industrial division develops and manufactures rotary and linear bearing solutions, drive technology components and systems, and service solutions, such as sensor-based condition monitoring systems. This division serves customers in the wind, raw materials, aerospace, rail, offroad, two wheelers, power transmission, and industrial automation sectors. The company was formerly known as INA Beteiligungsgesellschaft mit beschränkter Haftung and changed its name to Schaeffler AG in October 2014. The company was founded in 1946 and is headquartered in Herzogenaurach, Germany. Schaeffler AG is a subsidiary of IHO Verwaltungs GmbH.",,2025-04-27,True
DE000A3ENQ51,SCHOTT PHARMA AG & CO. KGAA,DE,1SXP.DE,XETRA,Healthcare,Medical Instruments & Supplies,DE,"Hattenbergstrasse 10 Mainz, 55122",50.015697,8.2440317,EUR,4749.0,150620000.0,159370000.0,23.22,77.0,18.98,"SCHOTT Pharma AG &amp; Co. KGaA develops, manufactures, and sells drug containment solutions and delivery systems for injectable drugs for pharmaceutical, biotechnology, and life science industries worldwide. The company offers prefillable glass or polymer syringes, glass vials, cartridges, and ampoules. Its syringe products include syriQ, a glass syringe for vaccines; syriQ BioPure, a glass syringe for biologics; syriQ BioPure silicone-free, a prefillable and silicone-free glass syringe for biologics; SCHOTT TOPPAC, a polymer syringe; SCHOTT TOPPAC cosmetic, a polymer syringe for aesthetic treatments; SCHOTT TOPPAC freeze, a polymer syringe for deep-cold applications; SCHOTT TOPPAC sensitive, a polymer syringe for sensitive drugs; SCHOTT TOPPAC infuse, a polymer syringe for infusion therapy; and SCHOTT TOPPAC unique, a polymer container. It also provides products comprising cartriQ, a pharmaceutical glass cartridge for peptide and protein-based injectables; cartriQ Large Volume, a pharmaceutical glass cartridge for large-volume injectables; Cartridges Double Chamber, a pharmaceutical glass cartridge for lyophilized drugs; Cartridges Break Resistant, a pharmaceutical glass cartridge; and TopLine and StandardLine cartridges. In addition, the company offers adaptiQ, a pharmaceutical glass vial for injectables; EVERIC pure, a pharmaceutical glass vial for unmatched drug stability; EVERIC care, a pharmaceutical glass vial for a pH range; EVERIC strong &amp; smooth, a pharmaceutical glass vial for the filling line performance; SCHOTT Type I plus, a pharmaceutical glass vial for drug formulations; SCHOTT TopLyo, a pharmaceutical glass vial to avoid fogging for lyophilized drugs; and TopLine and StandardLine vials. Further, it provides ampoule products comprise Ampoules easyOPC, a pharmaceutical glass ampoule for ampoule opening; Ampoules Anti-Counterfeiting, a pharmaceutical glass ampoule for protection against drug counterfeiting; and StandardLine ampoules. The company was founded in 1884 and is headquartered in Mainz, Germany. SCHOTT Pharma AG &amp; Co. KGaA operates as a subsidiary of Schott Glaswerke Beteiligungs- Und Export Gmbh.",,2025-04-27,True
FR0010411983,SCOR SE,FR,SCR.PA,Paris,Financial Services,Insurance—Reinsurance,FR,"5, avenue Kléber Paris, 75795",48.8716314,2.2938452,EUR,3621.0,179160000.0,207960000.0,82.41,3.31,48.69,"SCOR SE, together with its subsidiaries, provides life and non-life reinsurance products in Europe, the Middle East, Africa, the Americas, Latin America, and the Asia Pacific. It operates in two segments, SCOR P&amp;C and SCOR L&amp;H. The SCOR P&amp;C segment offers reinsurance products in the areas of property, motors, casualty treaties, credit and surety, decennial insurance, aviation, marine and energy, engineering, agricultural risks, and property catastrophes; specialties insurance products, including business solutions, political and credit risks, cyber, and environmental liability; and business ventures and partnerships. The SCOR L&amp;H segment provides life reinsurance products, such as protection for mortality, morbidity, behavioral risks, disability, long-term care, critical illness, medical, and personal accident. This segment also provides financial solutions that combine traditional life reinsurance with financial components and provide liquidity, balance sheet, solvency, and income improvements to clients; and longevity solutions that include products covering the risk of negative deviation from expected results due to the insured or annuitant living longer than assumed in the pricing of insurance covers provided by insurers or pension funds. The company is involved in the asset management business. SCOR SE was incorporated in 1956 and is headquartered in Paris, France.",,2025-04-27,True
