ISIN,Name,NCA,Yahoo_ticker,Main_exchange,Sector,Industry,Country,Address,Lat,Lng,Currency,Employees,Shares_outstanding,Implied_shares_outstanding,Float[%],Insiders[%],Institutions[%],Description,Termination_date,Record_retrieved,Selectable
IT0001233417,A2A SPA,IT,A2A.MI,Milan,Utilities,Utilities—Diversified,IT,"Corso di Porta Vittoria, 4 Milan, MI 20122",45.4626236,9.1974298,EUR,14777.0,3130000000.0,3130000000.0,50.16,50.0,14.97,"A2A S.p.A. engages in the production, sale, and distribution of gas and electricity, and district heating in Italy and internationally. The company generates electricity through hydroelectric, thermoelectric, photovoltaic, cogeneration, biomass, and wind plants; and sells and distributes gas. It also engages in the production and sale of heat produced through district heating networks; waste management activities, including collection and street sweeping, treatment, disposal, and recovery of materials and energy; and the construction and management of integrated waste disposal plants and systems. In addition, the company offers integrated water cycle management services; and technical consultancy services relating to energy efficiency certificates. Further, it is involved in the management of public lighting systems and street lights, and water purification and sewer activities, as well as offers garbage collection, street sweeping, video surveillance, energy efficiency, and electric mobility services. A2A S.p.A. is headquartered in Milan, Italy.",,2025-04-27,True
FR0012333284,ABIVAX,FR,ABVX.PA,Paris,Healthcare,Biotechnology,FR,"7-11 boulevard Haussmann Paris, 75009",48.8723294,2.3366469,EUR,69.0,63420000.0,63420000.0,50.49,1.79,49.26,"ABIVAX Société Anonyme, a clinical-stage biotechnology company, focuses on developing therapeutics that harness the body's natural regulatory mechanisms to stablize the immune response in patients with chronic inflammatory diseases. The company is evaluating its lead drug candidate, obefazimod, in Phase 3 clinical trials for the treatment of moderately to severely active ulcerative colitis in adults and Phase 2b clinical trial of obefazimod in patients with Crohn's disease. ABIVAX Société Anonyme was incorporated in 2013 and is headquartered in Paris, France.",,2025-04-27,True
FR0000120404,ACCOR,FR,AC.PA,Paris,Consumer Cyclical,Lodging,FR,"82, rue Henri-Farman CS 20077 Issy-les-Moulineaux, 92130",48.8329609,2.2692105,EUR,19423.0,244970000.0,26930000.0,72.48,3.4,60.96,"Accor SA operates a chain of hotels worldwide. It operates through Premium, Midscale and Economy; and Luxury &amp; Lifestyle segments. The Premium, Midscale and Economy segment includes the Ibis, Novotel, Mercure, Swissôtel, Mövenpick, and Pullman brands operating in Europe and North Africa, the Middle East, Africa, the Asia-Pacific, the Americas, and China. Its Luxury &amp; Lifestyle segment includes the Raffles and Fairmont, Sofitel, MGallery and Emblems, and Ennismore brands. The company also owns, leases, manages, and franchises hotels. In addition, it provides discount card programs; catering and event management; digital, online hotel booking, and concierge services; and other services in events, fine dining, and entertainment, as well as rental of luxury private residences; and operation of performance venues and coworking spaces. Further, the company offers hotel management, procurement, cash management, IT, and advertising services, as well as various advisory services. Accor SA was incorporated in 1960 and is headquartered in Issy-les-Moulineaux, France.",,2025-04-27,True
DE000A255F11,ACTUSRAYPARTNERS LIMITED,DE,VH2.F,Frankfurt,Industrials,Engineering & Construction,DE,"Harburger Straße 19 Tostedt, 21255",53.2924658,9.7342368,EUR,2077.0,200000.0,21950000.0,,65.62,20.13,"Friedrich Vorwerk Group SE provides various solutions for transformation and transportation of energy in Germany and Europe. The company operates through Natural Gas, Electricity, Clean Hydrogen, and Adjacent Opportunities segments. The Natural Gas segment comprises infrastructure services and product solutions for the transport and conversion of raw natural gas into processed natural gas; and engages in transporting the natural gas through high-pressure pipelines to processing in filtering and separation plants, compressor stations, storage and metering systems, LNG terminals, and gas pressure control and metering systems. The Electricity segment provides infrastructure for the underground transport and conversion of electricity that is generated from non-fossil energy sources, such as wind, sun, water, and renewable raw materials. This segment is involved in landing offshore electricity and installing high-voltage underground cables through which electricity is transported to transmission grids. The Clean Hydrogen segment provides product solutions and infrastructure services for the conversion of energy from energy sources into hydrogen, and its transportation to consumers, which is done through conversion of renewable energy by electrolysis; and processing and transportation of the clean hydrogen produced through storage systems, compressor stations, pipelines, and gas pressure control and measurement systems. The Adjacent Opportunities segment provides technologies, such as the treatment and cleaning of biogenic and synthetic gases; heat extraction technologies used in district heating; solutions for the transportation of drinking and wastewater; and specialty solutions for the chemical and petrochemical industry. Friedrich Vorwerk Group SE was founded in 1962 and is headquartered in Tostedt, Germany.",,2025-04-27,True
DE000A0Z23Q5,ADESSO SE,DE,ADN1.F,Frankfurt,Technology,Information Technology Services,DE,"Adessoplatz 1 Dortmund, 44269",51.5043067,7.5267767,EUR,10320.0,6520000.0,6640000.0,20.71,49.36,16.91,"adesso SE, together with its subsidiaries, provides IT services in Germany, Austria, Switzerland, and internationally. It operates through two segments, IT Services and IT Solutions. The company offers industry-specific IT consulting and software development services; and distributes software products and industry-specific or industry-neutral solutions. The company provides application management, data and analytics, digital and customer experience, interaction room, IT management and organizational consulting, SmartShore, security, and other services. It serves automotive, banks/financial services, utilities, healthcare, retail, life sciences, lottery, manufacturing, media and entertainment, food, exhibition, sports, public authorities, public transportation, and insurance industries. The company was founded in 1997 and is based in Dortmund, Germany.",,2025-04-27,True
DE000A1EWWW0,ADIDAS AG,DE,ADS.DE,XETRA,Consumer Cyclical,Footwear & Accessories,DE,"Adi-Dassler-Strasse 1 Herzogenaurach, 91074",49.579672,10.9167944,EUR,46045.0,178550000.0,178550000.0,93.16,6.64,52.09,"adidas AG, together with its subsidiaries, designs, develops, produces, and markets athletic and sports lifestyle products in Europe, the Middle East, Africa, North America, Greater China, the Asia-Pacific, and Latin America. It offers footwear, apparel, and accessories and gear, such as bags and balls under the adidas brand; golf footwear and apparel under the adidas Golf brand; and outdoor footwear under the Five Ten brand. It sells its products through its own retail stores; mono-branded franchise stores and shop-in-shops; and wholesale and its e-commerce channels. The company was formerly known as adidas-Salomon AG and changed its name to adidas AG in June 2006. adidas AG was founded in 1920 and is headquartered in Herzogenaurach, Germany.",,2025-04-27,True
FR0011184241,ADOCIA,FR,ADOC.PA,Paris,Healthcare,Biotechnology,FR,"115 Avenue Lacassagne Lyon, 69003",45.7500252,4.8760211,EUR,76.0,18040000.0,18250000.0,22.12,20.58,14.41,"Adocia SA, a clinical-stage biotechnology company, researches and develops formulations of pre-approved therapeutic proteins and peptides for the treatment of diabetes and other metabolic diseases. Its proprietary BioChaperone technological platform provides molecular delivery of therapeutic proteins. The company's clinical product pipeline includes insulin formulations, such as BioChaperone Lispro U100 and U200, which are ultra-rapid formulations based on rapid insulin lispro; BioChaperone Combo, a combination of acting insulin glargine and rapid-acting insulin lispro; and BioChaperone LisPram, a combination of prandial insulin with pramlintide, as well as M1Pram, a combination of insulin M1 and pramlintide. Its preclinical pipeline includes products for the treatment of diabetes and obesity comprising AdoShell Islets, an implant containing islets of Langerhans; AdOral Sema, an oral delivery of semaglutide; and AdoGel Sema for the long-term delivery of therapeutic agents. The company has a strategic alliance with Tonghua Dongbao Pharmaceutical Co., Ltd. to develop and commercialize BioChaperone Lispro and BioChaperone Combo in China and other Asian and Middle Eastern territories. Adocia SA was incorporated in 2005 and is headquartered in Lyon, France.",,2025-04-27,True
DE0006452907,ADVA OPTICAL NETWORKING SE,DE,NEM.DE,XETRA,Technology,Software—Application,DE,"Konrad-Zuse-Platz 1 Munich, 81829",48.1366959,11.6882967,EUR,3894.0,11550000.0,118560000.0,,51.0,32.14,"Nemetschek SE provides software solutions for architecture, engineering, construction, media, and entertainment markets in Germany, rest of Europe, the Americas, the Asia Pacific, and internationally. It operates through four segments: Design, Build, Manage, and Media. The Design segment offers software solutions primarily under the Allplan, Graphisoft, Solibri, Precast, Vectorworks, SCIA, dRofus, Frilo, and RISA brands for architects, designers, engineers, structural engineers, specialist planners, and landscape designers, as well as developers and general contractors. This segment provides building information modeling (BIM) solutions for computer aided design and computer aided engineering. The Build segment offers integrated complete 5D BIM solutions primarily under the Bluebeam brand that support bidding and awarding, invoicing, budgeting, scheduling, and cost calculation. This segment serves construction companies, developers, building supplies, and general contractors, as well as planning offices, architects, and civil engineers. The Manage segment provides solutions for building and infrastructure projects; professional property management; and offer modular and integrated software solutions for property, facility, and workplace management under the Spacewell brand. The Media segment offers software solutions under the Maxon name for rendering 3D modeling, animation, painting, and sculpting. This segment includes film and television studio, advertising studios, video game production, freelancing, graphic designing, and other related activities. Nemetschek SE was founded in 1963 and is headquartered in Munich, Germany.",,2025-04-27,True
FR001400J770,AIR FRANCE-KLM,FR,AF.PA,Paris,Industrials,Airlines,FR,"7, rue du Cirque Paris, 75008",48.8702456,2.3140753,EUR,58423.0,262660000.0,263790000.0,43.56,54.45,8.43,"Air France-KLM SA, together with its subsidiaries, provides passenger and cargo transportation services worldwide. The company operates through Network, Maintenance, Transavia, and Other segments. It also offers airframe and engine maintenance, and component support, including electronic, mechanical, pneumatic, hydraulic, and other services. The company provides its services under the Air France, KLM, and Transavia brand names. It operates in Metropolitan France, Europe, North Africa, Caribbean, West Indies, French Guyana, Indian Ocean, Africa, the Middle East, North America, Mexico, South America, Asia, and New Caledonia. The company was founded in 1919 and is headquartered in Paris, France.",,2025-04-27,True
FR0000031122,AIR FRANCE-KLM,FR,AF.PA,Paris,Industrials,Airlines,FR,"7, rue du Cirque Paris, 75008",48.8702456,2.3140753,EUR,58423.0,262660000.0,263790000.0,43.56,54.45,8.43,"Air France-KLM SA, together with its subsidiaries, provides passenger and cargo transportation services worldwide. The company operates through Network, Maintenance, Transavia, and Other segments. It also offers airframe and engine maintenance, and component support, including electronic, mechanical, pneumatic, hydraulic, and other services. The company provides its services under the Air France, KLM, and Transavia brand names. It operates in Metropolitan France, Europe, North Africa, Caribbean, West Indies, French Guyana, Indian Ocean, Africa, the Middle East, North America, Mexico, South America, Asia, and New Caledonia. The company was founded in 1919 and is headquartered in Paris, France.",,2025-04-27,True
DE000A0WMPJ6,AIXTRON SE,DE,AIXA.DE,XETRA,Technology,Semiconductor Equipment & Materials,DE,"Dornkaulstrasse 2 Herzogenrath, 52134",50.823408,6.0793379,EUR,1207.0,112670000.0,112670000.0,100,0.0,54.33,"AIXTRON SE, together with its subsidiaries, provides deposition equipment to the semiconductor industry in Asia, Europe, and the Americas. It develops, produces, and installs equipment for the deposition of semiconductor materials; and offers deposition processes, consulting, training, customer support, and other related services, as well as peripheral devices and services for the operation of its systems. The company's product portfolio includes MOCVD, CVD and PECVD, and OVPD and PVPD systems. It also supplies deposition equipment for volume production, as well as for research and development and pre-series productions. The company's products are used in a range of compound semiconductors and optoelectronic applications, as well as lasers, LED, display technologies, optical and wireless data transmission, SiC and GaN power electronics, and other applications. AIXTRON SE was founded in 1983 and is headquartered in Herzogenrath, Germany.",,2025-04-27,True
FR0010220475,ALSTOM,FR,ALO.PA,Paris,Industrials,Railroads,FR,"48, rue Albert Dhalenne Saint-Ouen, 93400",48.913621,2.3317867,EUR,78684.0,461510000.0,461510000.0,76.84,2.45,60.12,"Alstom SA provides solutions for rail transport industry in Europe, the Americas, Asia and Pacific, the Middle East, Central Asia, and Africa. The company offers rolling stock solutions comprising people movers and monorails, light rails, metros, commuter trains, regional trains, high-speed trains, and locomotives; asset optimization, cybersecurity, connectivity, digital passenger, and security and city mobility solutions; and signaling products, such as urban, mainline, and freight and mining signaling. It also provides APM, monorail, tram, metro, and main line systems; and tracklaying and track solutions, catenary free and ground feeding solutions, electrification solutions, and electromechanical equipment, as well as cybersecurity solutions. In addition, the company provides maintenance, modernization, overhaul, parts and repair, and support services. Further, it offers various components, including bogies, motors and generators, friction brakes, switchgears, gearboxes, traction and auxiliary converters, transformers, components propulsion, green traction solutions, interiors and train control and information systems, hydrogen and battery solutions, and dispen dampers. The company was founded in 1928 and is based in Saint-Ouen, France.",,2025-04-27,True
FR0000071946,ALTEN,FR,ATE.PA,Paris,Technology,Information Technology Services,FR,"40, avenue AndrE Morizet Cedex Boulogne-Billancourt, 92513",48.83664,2.2378087,EUR,,34790000.0,39750000.0,,16.73,50.32,"Alten S.A. operates as an engineering and technology consultancy company in France, North America, Germany, Scandinavia, Benelux, Iberian, Spain, Italy, the United Kingdom, the Asia-Pacific, Switzerland, Eastern Europe, and internationally. The company undertakes design and research projects for the technical and information systems divisions in the industrial and telecommunication sectors. It also offers engineering, and research and development outsourcing services, such as digital transformation; product design and development; manufacturing engineering; supply chain and quality; customer service and training; and project and change management consulting services. In addition, the company provides IT services comprising consulting and digital transformation; technical services for digital, big data, data science, and artificial intelligence; development, maintenance, and testing of applications; and cloud, and networks and security infrastructure services. It serves customers in aeronautics, space, defense and naval, security, automotive, rail, energy and environment, life sciences, banking, finance and insurance, telecoms and media, retail and consumer services, and public sectors and government services. Alten S.A. was founded in 1988 and is headquartered in Boulogne-Billancourt, France.",,2025-04-27,True
DE0005093108,AMADEUS FIRE AG,DE,AAD.DE,XETRA,Industrials,Staffing & Employment Services,DE,"Hanauer Landstrasse 160 Frankfurt am Main, 60314",50.1130708,8.7172708,EUR,1836.0,5430000.0,5430000.0,8.47,0.0,71.79,"Amadeus FiRe AG provides personnel and training services in Germany. It offers specialized personnel services, such as specialist temporary staffing, permanent placement, interim and project management for professional and management staff in commercial professions and IT fields. The company provides retraining and advanced vocational training options with a focus on commercial and IT sectors; and training for business clients through open or in-house seminars. In addition, it offers courses and degree programs for private individuals, including professional training in the fields of tax, accounting, and controlling; private-sector certification courses for finance and accounting; specialized training in international financial reporting comprising IAS/IFRS and US GAAP; master's degree program in taxation; and educational content on IT, multimedia, and commercial subjects, as well as publicly funded training services under the Comcave College, GFN, Steuer-Fachschule Dr. Endriss, Akademie für Internationale Rechnungslegung, and TaxMaster brands. The company was founded in 1986 and is headquartered in Frankfurt am Main, Germany.",,2025-04-27,True
IT0004056880,AMPLIFON SPA,IT,AMP.MI,Milan,Healthcare,Medical Distribution,IT,"Via Ripamonti 133 Milan, MI 20141",45.4380347,9.2012647,EUR,11603.0,224930000.0,237280000.0,57.9,42.0,34.65,"Amplifon S.p.A. engages in the distribution of hearing solutions and the fitting of customized products that helps people to rediscover various emotions of sound in Europe, the Middle East, Africa, the Americas, and the Asia Pacific. The company operates Ampli-care, a platform to deliver audiological care experience; and Amplifon App to manage the device functions in real-time directly from smartphone. It also offers Ampli-easy, Ampli-connect, Ampli-energy, and Ampli-mini hearing devices. The company was founded in 1950 and is headquartered in Milan, Italy.",,2025-04-27,True
IT0004998065,ANIMA HOLDING SPA,IT,ANIM.MI,Milan,Financial Services,Asset Management,IT,"Corso Giuseppe Garibaldi, 99 Milan, MI 20121",45.4774253,9.1838121,EUR,494.0,325220000.0,32630000.0,93.56,0.0,110.96,"Anima Holding S.p.A. is a publicly owned investment manager. The firm invests in the public equity markets of Italy. The firm offers various investment schemes and foreign SICAVs, and institutional and private pension funds, mutual funds, open-ended umbrella funds as well as private wealth and institutional asset management services. It employs fundamental analysis to make its investments. It provides asset management services in Italy. Anima Holding S.p.A. is based in Milan, Italy.",,2025-04-27,True
IT0005241192,AQUAFIL SPA,IT,ECNL.MI,Milan,Consumer Cyclical,Textile Manufacturing,IT,"Via Linfano, 9 Arco, TN 38062",45.9055832,10.8791064,EUR,,71890000.0,850000.0,,29.46,4.7,"Aquafil S.p.A., together with its subsidiaries, engages in the production, reprocessing, and sale of polyamide 6 fibers and polymers in Europe, the Middle East, Africa, Asia, Oceania, and the United States. The company offers bulk continuous filament or synthetic yarns for the textile flooring sector, as well as used in hotels, airports, offices, etc., and residential buildings and the automotive market; nylon textile filaments for sportswear, classic, and technical or specialist apparels; and polymers products or plastic raw materials primarily for engineering plastics sector for use in molding industry, as well as manufactures and sells polymers for use in accessories in the fashion and designer furniture industries. It is also involved in the design and construction of industrial chemical plants. The company markets its products under the Dryarn and ECONYL brands. The company was founded in 1965 and is headquartered in Arco, Italy. Aquafil S.p.A. operates as a subsidiary of Aquafin Holding S.p.A.",,2025-04-27,True
NL0015000N33,ARISTON HOLDING N.V.,IT,ARIS.MI,Milan,Industrials,Building Products & Equipment,IT,"Via Broletto 44 Milan, MI 20121",45.4679345,9.1857032,EUR,9947.0,120950000.0,362090000.0,63.26,34.94,46.07,"Ariston Holding N.V., through its subsidiaries, produces and distributes hot water and space heating solutions in the Netherlands, Germany, Italy, Switzerland, and internationally. It operates in three divisions: Thermal Comfort, Burners, and Components. The company offers water heating products, such as heat pumps, gas storage and gas instant water heaters, and cylinders, as well as solar, electric storage, electric instant water heaters; and space heating products comprising boilers, heat pumps, hybrid systems, air and conditioning products, thermostats, and direct services and parts. It also provides burners and components; and heat-recovery ventilation and air handling products. The company offers its products under the brands of Ariston, Elco, Wolf, ATAG, Calorex, Brink, NTI, Chaffoteaux, Racold, Domotec, Chromagen, Thermowatt, and Ecoflam brands. It also sells its products through online. Ariston Holding N.V. was founded in 1930 and is headquartered in Milan, Italy. Ariston Holding N.V. operates as a subsidiary of Merloni Holding S.P.A.",,2025-04-27,True
FR0010313833,ARKEMA,FR,AKE.PA,Paris,Basic Materials,Specialty Chemicals,FR,"420 rue d'Estienne d'Orves Cedex Colombes, 92700",48.9089073,2.2304359,EUR,21082.0,75540000.0,7680000.0,75.5,6.23,53.65,"Arkema S.A. manufactures and sells specialty materials in Europe, the United States, Canada, Mexico, China, Hong Kong, Taiwan, and internationally. The company operates in three segments: Adhesive Solutions, Advanced Materials and Coating Solutions, and Intermediates. The Adhesive Solutions segment provides solutions for construction, renovation of buildings, DIY, durable goods, and packaging and non-woven applications; and supplies technologies used in building activities for businesses and individuals, including sealants, tiles, flooring adhesives and waterproofing systems, and technologies used in industry, which include automotive, textiles, glazing, flexible and rigid packaging, and hygiene markets. This segment also offers performance polymers, such as specialty polyamides, PVDF, polyimides, fluorospecialties, and PEKK; and performance additives that includes interface agents combining specialty surfactants, molecular sieves, organic peroxides, thiochemicals, and hydrogen peroxide. The Advance Materials and Coating Solutions segment offers coating solutions, comprising EU/US acrylics and coating resins; coating additives, such as sartomer photocure resins, and coatex rheology additives and specialties. This segment also provides decorative paints, industrial coatings, and adhesives; and solutions for applications in the paper, superabsorbent, water treatment and oil and gas extraction, and 3D printing and electronics markets. The Intermediates segment offers fluorogases and Asia acrylics; and industrial intermediate chemicals for construction, refrigeration and air conditioning, automotive, coatings, and water treatment sectors. Arkema S.A. was incorporated in 2003 and is headquartered in Colombes, France.",,2025-04-27,True
SE0023615638,ASMODEE GROUP AB,DE,ASMDEE-B.ST,Stockholm,Consumer Cyclical,Leisure,FR,"33 avenue Emile Zola Boulogne-Billancourt, 92100",48.8268221,2.2381947,SEK,2386.0,224690000.0,233690000.0,0.81,32.1,30.89,"Asmodee Group AB (publ) engages in publishing and distributing tabletop games. The company offers board games, card games, and all other type of games played on or around table. Its portfolio includes CATAN, Ticket to ride, Dobble/Spot-it!, and Exploding Kittens. The company also establishes third-part licensing and/or distribution collaborations with entertainment franchises and third-party IP owners. It operates in Sweden, France, Germany, the United States, the United Kingdom, other Americas, other Europe, and internationally. The company was founded in 1995 and is headquartered in Boulogne-Billancourt, France. Asmodee Group AB (publ) operates as a subsidiary of Embracer Group AB (publ).",,2025-04-27,True
